{"artifact_type":"wmloop-constitutional-freeze","constitution_id":"acwm_g1_long_horizon_ladder_v1","constitution_sha256":"4d1d3d10f38aae4504ba19fdcb858fe9edfabd5b77c32f217961df156147a8a7","entries":[{"component":"constitution_config","path":"configs/constitution/acwm_g1_long_horizon_ladder_v1.json","sha256":"c95b053da87a26c66959f3525b4404f8d500beb1edfd0605040cc4ae0eac16ef","size":1212},{"component":"goal_spec","path":"configs/goal/g1_long_horizon_ladder_v1.yaml","sha256":"de37eb2480fac3e24cae1165f9043375d05f2daa4460a65c0b8f126b8d859672","size":1501},{"component":"dataset_freeze","path":"runs/m0/protocol/dataset-freeze.json","sha256":"4d4a3076302790508bf52fbcbd34ce9add27bfeb44df8005bf35d7256222968f","size":216717},{"component":"heldout_protocol","path":"runs/m0/protocol/heldout-protocol.json","sha256":"77c406a6949b33fd00f5029c3e168179e660d1e4255487327519db725e80d3d7","size":143436},{"component":"evaluator_freeze","path":"configs/eval_frozen.sha256","sha256":"b474f2452f5b8e78722fff8d39a87924fa970fae4e0dc8b1bdd3295c5fe96956","size":280},{"component":"probe_registry","path":"configs/probes/acwm_v1.json","sha256":"3bb291d05725214f9930c0b2edc5cd552e838a88395bfb5655136d1ccedd6e35","size":956},{"component":"horizon_ladder","path":"configs/goal/horizon_ladder_g1_acwm_phys_v1.yaml","sha256":"6a18ef5a46c907bacf45dbd674cd48bebeaddc2f2b7b577ff1455dba65ec6356","size":1966},{"component":"code:attribution_policy","path":"wmloop/diagnose/diagnoser.py","sha256":"af0a367c9f623cfcbdae009b8ce9116111061eca15e4899997efca56cd769e9a","size":8347},{"component":"code:hook_contracts","path":"wmloop/primitives/hooks.py","sha256":"3916a9981325d1f01bf82c964b30173f7fa2e13520ef870285cfbe0fab17fe5f","size":4776},{"component":"code:schema_contracts","path":"configs/schemas/goal_spec.schema.json","sha256":"0d261224ed8ae87f40177a5cb3dcf47a051a533461a094b578c6f3af597ad854","size":2743},{"component":"code:schema_contracts","path":"configs/schemas/horizon_ladder.schema.json","sha256":"6b3ae9dad3d50e63985122308b83b1dc9cb1b4c1922173dde21e2a011e9ce18c","size":4702},{"component":"code:schema_contracts","path":"configs/schemas/probe_registry.schema.json","sha256":"31755b4f18d207693896a38d881fc3023847287d7dca7fc2f0ae439859b19264","size":880},{"component":"code:schema_contracts","path":"configs/schemas/verdict_evidence.schema.json","sha256":"5100ced49ec3eb39d2d0abe8b385dc59ca00bca2bd46cf980ff6fe7a9188cf81","size":805},{"component":"code:schema_contracts","path":"configs/schemas/constitutional_config.schema.json","sha256":"cae2b147ca2d06a6a581ec870a1bd0b699e868d2840531748544c11292bd19ed","size":1005},{"component":"code:schema_contracts","path":"configs/schemas/constitutional_manifest.schema.json","sha256":"5ea91982f9241e7f01a6077c0b7361aa0467c8aa797259477dbe6b9a745c2355","size":1174},{"component":"code:verdict_evidence_projection","path":"wmloop/diagnose/probe_registry.py","sha256":"cf0c944737f9a47b7289f8feeee1d3c9b02a2c0dd9ec8701b8723e9f4dcdd2ca","size":4296},{"component":"code:verdict_policy","path":"wmloop/verify/judge.py","sha256":"9e6c2c805902681473dc0fb3543becd30f4e3afbf90fb3481b292e24945da55e","size":6199},{"component":"code:verdict_policy","path":"configs/schemas/verdict.schema.json","sha256":"bcfbd92b9a3e3f0daeb674ea58bef4b6dc607e8d37ad6aee0d9eab26509e4206","size":732}],"goal_id":"g1_long_horizon_ladder_v1","schema_version":1,"verdict_probe_ids":["horizon_curve","action_following"]}
