{"artifact_type":"wmloop-constitutional-freeze","constitution_id":"ctrl_world_g2_action_success_pilot_v1","constitution_sha256":"fd51620b5ddf1045506e721d114ea897f5450479d45332f931c7a160c94d0a99","entries":[{"component":"constitution_config","path":"configs/constitution/ctrl_world_g2_action_success_pilot_v1.json","sha256":"d31ea010060a8d7862b2e16c3222f2de36d8c364c2e8e7280aa1e2e9a16a7721","size":1461},{"component":"goal_spec","path":"configs/goal/ctrl_world_g2_action_success_pilot_v1.yaml","sha256":"191671ede3957cf7ee4b1317f5471cb340cfa4f08a899c2376b973df96c9b7c8","size":535},{"component":"dataset_freeze","path":"configs/backbones/ctrl_world_g2_dataset_freeze.json","sha256":"8619b57bc8ec0c72a2f49946e6530a7ef9f94b4b29c759be9ebffa7fe15a8656","size":4013},{"component":"heldout_protocol","path":"configs/goal/ctrl_world_heldout_split.json","sha256":"07b7874d9dd4e6760c8480be8a17e263bd41a7328763985d9d16efbd25de7f0b","size":659},{"component":"evaluator_freeze","path":"configs/eval_ctrl_world_g2_frozen.sha256","sha256":"aad1d5d0266db1a9304e0ef8af96ddefd0457f6fbe3f542af3e24b36a31e7a4c","size":967},{"component":"probe_registry","path":"configs/probes/ctrl_world_wam_v1.json","sha256":"617ef4505954b8ab1b297ce094e417c7dc091122815b34462ebd6401412fd785","size":1214},{"component":"code:attribution_policy","path":"wmloop/diagnose/diagnoser.py","sha256":"af0a367c9f623cfcbdae009b8ce9116111061eca15e4899997efca56cd769e9a","size":8347},{"component":"code:hook_contracts","path":"wmloop/primitives/hooks.py","sha256":"3916a9981325d1f01bf82c964b30173f7fa2e13520ef870285cfbe0fab17fe5f","size":4776},{"component":"code:hook_contracts","path":"wmloop/primitives/adapters/ctrl_world_hooks.py","sha256":"6ea714be06e113a248a2d94decb52fccee525efc74f818b54d77feca3f50e00c","size":1380},{"component":"code:hook_contracts","path":"wmloop/primitives/adapters/backbone_registry.py","sha256":"bf667a93be5569a56146163317a8406c082d5761fb6bd60efe21aa17af0f1c19","size":5940},{"component":"code:hook_contracts","path":"configs/registry_ctrl_world_g2.sha256","sha256":"9d2f6529d4d82fbe82cc7a9a42cf832d56607cf45c7b83e3da4893d5cab3da6f","size":8145},{"component":"code:schema_contracts","path":"configs/schemas/goal_spec.schema.json","sha256":"0d261224ed8ae87f40177a5cb3dcf47a051a533461a094b578c6f3af597ad854","size":2743},{"component":"code:schema_contracts","path":"configs/schemas/probe_registry.schema.json","sha256":"31755b4f18d207693896a38d881fc3023847287d7dca7fc2f0ae439859b19264","size":880},{"component":"code:schema_contracts","path":"configs/schemas/ctrl_world_heldout_split.schema.json","sha256":"7826d1a04cfbe38392442e6efdb9805f127ead968b2e81f918ee91faafdb3c95","size":1066},{"component":"code:schema_contracts","path":"configs/schemas/backbone_primitive_registry.schema.json","sha256":"75294fc1e4a111012fd85dc669c9b0a641c848b9b8b0d09f9d563c0269b25755","size":2861},{"component":"code:schema_contracts","path":"configs/schemas/constitutional_config.schema.json","sha256":"cae2b147ca2d06a6a581ec870a1bd0b699e868d2840531748544c11292bd19ed","size":1005},{"component":"code:schema_contracts","path":"configs/schemas/constitutional_manifest.schema.json","sha256":"5ea91982f9241e7f01a6077c0b7361aa0467c8aa797259477dbe6b9a745c2355","size":1174},{"component":"code:verdict_evidence_projection","path":"wmloop/diagnose/probe_registry.py","sha256":"cf0c944737f9a47b7289f8feeee1d3c9b02a2c0dd9ec8701b8723e9f4dcdd2ca","size":4296},{"component":"code:verdict_policy","path":"wmloop/evaluate/adapters/ctrl_world.py","sha256":"e0c0ebbfba25f4da90f7ba7ac5fd178a7573bcc3f276f86a852d8819b5c31f2d","size":2625},{"component":"code:verdict_policy","path":"configs/schemas/ctrl_world_rollout_receipt.schema.json","sha256":"ce8c2997d9ddb5ecdc570681194d06fe511c3d0974bd1d6dab2f37827cc9249a","size":1050}],"goal_id":"ctrl_world_g2_action_success_pilot_v1","schema_version":1,"verdict_probe_ids":["task_success","task_progress","safety_events"]}
