{"artifact_type":"wmloop-constitutional-freeze","constitution_id":"ctrl_world_predictive_quality_pilot_v1","constitution_sha256":"428548babd2a550c28ffec1ee92208487c1398decbb53d8c53919db79ed07296","entries":[{"component":"constitution_config","path":"configs/constitution/ctrl_world_predictive_quality_pilot_v1.json","sha256":"3fba96bf02df9c3d3f79265f9fdb3231d47c900db175ea7e09c1d3a0ec23b7fc","size":1570},{"component":"goal_spec","path":"configs/goal/ctrl_world_predictive_quality_pilot_v1.yaml","sha256":"855fc38aece39e15a201e298a56ae84b9d0a6a50ea9c73a7280ff497fa6d075a","size":595},{"component":"dataset_freeze","path":"configs/backbones/ctrl_world_g2_dataset_freeze.json","sha256":"8619b57bc8ec0c72a2f49946e6530a7ef9f94b4b29c759be9ebffa7fe15a8656","size":4013},{"component":"heldout_protocol","path":"configs/goal/ctrl_world_heldout_split.json","sha256":"07b7874d9dd4e6760c8480be8a17e263bd41a7328763985d9d16efbd25de7f0b","size":659},{"component":"evaluator_freeze","path":"configs/eval_ctrl_world_predictive_v1.sha256","sha256":"7463cb2fdfdfba9c1fc8f671636ac3ef7b2c2a5c47f24abc0dfd2274a86cd509","size":1151},{"component":"probe_registry","path":"configs/probes/ctrl_world_acwm_predictive_v1.json","sha256":"11dce107a3598f5f3a0db462d0ac1ff1c16a75bde5889a595fd537755814fb4a","size":1647},{"component":"code:attribution_policy","path":"wmloop/diagnose/diagnoser.py","sha256":"af0a367c9f623cfcbdae009b8ce9116111061eca15e4899997efca56cd769e9a","size":8347},{"component":"code:fingerprint_policy","path":"wmloop/experiments/ctrl_world_fingerprint.py","sha256":"d96c0dcc46fa2b60bbba240a34907725738b8267d36d1a081f3d1ec31f6af8ed","size":12186},{"component":"code:fingerprint_policy","path":"configs/experiments/ctrl_world_irg_calibration_pilot_v1.json","sha256":"05057925e2c5c1a6a1824444ebf242d2a0df51325ca1e90c5b140a96b5eb5a86","size":1992},{"component":"code:hook_contracts","path":"wmloop/primitives/hooks.py","sha256":"3916a9981325d1f01bf82c964b30173f7fa2e13520ef870285cfbe0fab17fe5f","size":4776},{"component":"code:hook_contracts","path":"wmloop/primitives/adapters/ctrl_world_hooks.py","sha256":"6ea714be06e113a248a2d94decb52fccee525efc74f818b54d77feca3f50e00c","size":1380},{"component":"code:schema_contracts","path":"configs/schemas/goal_spec.schema.json","sha256":"0d261224ed8ae87f40177a5cb3dcf47a051a533461a094b578c6f3af597ad854","size":2743},{"component":"code:schema_contracts","path":"configs/schemas/probe_registry.schema.json","sha256":"31755b4f18d207693896a38d881fc3023847287d7dca7fc2f0ae439859b19264","size":880},{"component":"code:schema_contracts","path":"configs/schemas/ctrl_world_heldout_split.schema.json","sha256":"7826d1a04cfbe38392442e6efdb9805f127ead968b2e81f918ee91faafdb3c95","size":1066},{"component":"code:schema_contracts","path":"configs/schemas/constitutional_config.schema.json","sha256":"cae2b147ca2d06a6a581ec870a1bd0b699e868d2840531748544c11292bd19ed","size":1005},{"component":"code:schema_contracts","path":"configs/schemas/constitutional_manifest.schema.json","sha256":"5ea91982f9241e7f01a6077c0b7361aa0467c8aa797259477dbe6b9a745c2355","size":1174},{"component":"code:verdict_evidence_projection","path":"wmloop/diagnose/probe_registry.py","sha256":"cf0c944737f9a47b7289f8feeee1d3c9b02a2c0dd9ec8701b8723e9f4dcdd2ca","size":4296},{"component":"code:verdict_policy","path":"wmloop/evaluate/adapters/ctrl_world_predictive.py","sha256":"00ab1b0b9ce2634e5d2cf1df22682808b548f682ea0cc97c51a799fde5ebd323","size":2923},{"component":"code:verdict_policy","path":"configs/schemas/ctrl_world_prediction_receipt.schema.json","sha256":"9a5f3f0f04d16ff7eaff5e41ee130def9f2b2c94da0dfb7e3b191b2ca01a3fe5","size":1565}],"goal_id":"ctrl_world_predictive_quality_pilot_v1","schema_version":1,"verdict_probe_ids":["rollout_video_psnr","rollout_video_l1","segment_final_mae","segment_view_pair_mae","segment_view_fused_mae"]}
